{"schemaVersion":"1.0","eventId":"16161616-1616-4616-8616-161616161616","runId":"33333333-3333-4333-8333-333333333333","runVersion":3,"sequence":1,"occurredAt":"2026-08-27T18:00:00Z","eventType":"RUN_STATE_CHANGED","payload":{"previousState":"CREATED","state":"QUEUED","cancellationStatus":"NOT_REQUESTED"}}
