{"schemaVersion":"1.0","eventId":"17171717-1717-4717-8717-171717171717","runId":"33333333-3333-4333-8333-333333333333","runVersion":5,"attemptId":"44444444-4444-4444-8444-444444444444","sequence":2,"occurredAt":"2026-08-27T18:00:02Z","eventType":"EXECUTION_STARTED","payload":{"startedAt":"2026-08-27T18:00:02Z"}}
