{"schemaVersion":"1.0","eventId":"20202020-2020-4020-8020-202020202020","runId":"33333333-3333-4333-8333-333333333333","runVersion":8,"attemptId":"44444444-4444-4444-8444-444444444444","sequence":5,"occurredAt":"2026-08-27T18:05:02Z","eventType":"EXECUTION_COMPLETED","payload":{"resultId":"ffffffff-ffff-4fff-8fff-ffffffffffff","finishedAt":"2026-08-27T18:05:00Z","testOutcome":"PASSED","infrastructureOutcome":"SUCCEEDED"}}
