{"schemaVersion":"1.0","eventId":"19191919-1919-4919-8919-191919191919","runId":"33333333-3333-4333-8333-333333333333","runVersion":7,"attemptId":"44444444-4444-4444-8444-444444444444","sequence":4,"occurredAt":"2026-08-27T18:05:01Z","eventType":"ARTIFACT_AVAILABLE","payload":{"artifactId":"14141414-1414-4414-8414-141414141414","type":"KARATE_HTML_REPORT","sizeBytes":4096,"sha256":"sha256:aaaaaaaaaaaaaaaaaaaaaaaaaaaaaaaaaaaaaaaaaaaaaaaaaaaaaaaaaaaaaaaa"}}
