{"schemaVersion":"1.0","eventId":"18181818-1818-4818-8818-181818181818","runId":"33333333-3333-4333-8333-333333333333","runVersion":5,"attemptId":"44444444-4444-4444-8444-444444444444","sequence":3,"occurredAt":"2026-08-27T18:03:00Z","eventType":"PROGRESS","payload":{"completedScenarios":5,"totalScenarios":10}}
